0,1,2,3
,As a result of COVID-19 our global workforce continued to operate primarily in a work from home environment for,,
the quarter ended,,December 31 2020,. While pre-existing controls were not specifically designed to operate in our
current work from home operating environment we believe that our internal controls over financial reporting continue to,,,
be effective. We have continued to re-evaluate and refine our financial reporting process to provide reasonable,,,
assurance that we could report our financial results accurately and timely.,,,
