0,1
Table of Contents,Alphabet Inc.
product  warranty  product  liability  and  consumer  protection  claims  related  to  product  defects  among  other  litigation,
and  we  may  also  be  subject  to  claims  involving  health  and  safety  hazardous  materials  usage  other  environmental,
effects or service disruptions or failures. Claims have been brought and we expect will continue to be brought against,
us for defamation negligence breaches of contract copyright and trademark infringement unfair competition unlawful,
activity  torts  privacy  rights  violations  fraud  or  other  legal  theories  based  on  the  nature  and  content  of  information,
available  on  or  via  our  services  or  due  to  our  involvement  in  hosting  transmitting  marketing  branding  or  providing,
access to content created by third parties.,
,For example the U.S. Department of Justice various U.S. states and other plaintiffs have filed several antitrust
lawsuits about various aspects of our business including our advertising technologies and practices the operation and,
distribution of Google Search and the operation and distribution of the Android operating system and Play Store. Other,
regulatory agencies in the U.S. and around the world including competition enforcers consumer protection agencies,
and  data  protection  authorities  have  challenged  and  may  continue,to  challenge  our  business  practices  and
compliance  with  laws  and  regulations.  We  are  cooperating  with  these  investigations  and  defending  litigation  where,
appropriate.  Various  laws  regulations  investigations  enforcement  lawsuits  and  regulatory  actions  have  in  the  past,
and  may  in  the  future  result  in  substantial  fines  and  penalties  injunctive  relief  ongoing  monitoring  and  auditing,
obligations changes to our products and services alterations to our business models and operations and collateral,
related  civil  litigation  or  other  adverse  consequences  all  of  which  could  harm  our  business  reputation  financial,
condition and operating results.,
,Any of these legal proceedings could result in legal costs diversion of management resources negative publicity
and other harms to our business. Estimating liabilities for our pending litigation is a complex fact-intensive process that,
requires significant judgment and the amounts we are ultimately liable for may exceed our estimates. The resolution of,
one or more such proceedings has resulted in and may in the future result in additional substantial fines penalties,
injunctions and other sanctions that could harm our business reputation financial condition and operating results.,
,Privacy data protection and data usage regulations are complex and rapidly evolving areas. Any failure
or  alleged  failure  to  comply  with  these  laws  could  harm  our  business  reputation  financial  condition  and,
operating results.,
,Authorities around the world have adopted and are considering a number of legislative and regulatory proposals
concerning  data  protection  data  usage  and  encryption  of  user  data. Adverse  legal  rulings  legislation  or  regulation,
have resulted in and may continue to result in fines and orders requiring that we change our practices which have,
had  and  could  continue  to  have  an  adverse  effect  on  how  we  provide  services  harming  our  business  reputation,
financial condition and operating  results. These  laws and regulations are evolving and subject to interpretation and,
compliance  obligations  could  cause  us  to  incur  substantial  costs  or  harm  the  quality  and  operations  of  our  products,
and services in ways that harm our business. Examples of these laws include:,
