0,1
Table of Contents,Alphabet Inc.
defamation  negligence  breaches  of  contract  patent  copyright  and,"trademark 
infringement  unfair  competition"
unlawful  activity  torts  privacy  rights  violations  fraud  or  other  legal  theories  based  on  the  nature  and  content  of,
information  available  on  or  via  our  services  the  design  and  effect  of  our  products  and  services  or  due  to  our,
involvement in hosting transmitting marketing branding or providing access to content created by third parties.,
,Various laws regulations investigations enforcement lawsuits and regulatory actions have involved in the past
and  may  in  the  future  result  in  substantial  fines  and  penalties  injunctive  relief  ongoing  monitoring  and  auditing,
obligations  changes  to  our  products  and  services  alterations  to  our  business  models  and  operations  including,
divestiture and collateral related civil litigation or other adverse consequences. Any of these legal proceedings could,
also  result  in  legal  costs  diversion  of  management  resources  and  negative  publicity  all  of  which  could  harm  our,
business reputation financial condition and operating results.,
,Estimating liabilities for our pending proceedings is a complex fact-specific and speculative process that requires
significant  judgment  and  the  amounts  we  are  ultimately  liable  for  may  be  less  than  or  exceed  our  estimates.  The,
resolution of one or more such proceedings has resulted in and may in the future result in additional substantial fines,
penalties injunctions and other sanctions that could harm our business reputation financial condition and operating,
results.,
,For  additional  information  about  the  ongoing  material  legal  proceedings  to  which  we  are  subject  see  Legal
Proceedings in Item 3 of this Annual Report on Form 10-K.,
,Privacy data protection data usage and portability regulations are complex and rapidly evolving areas.
Any  failure  or  alleged  failure  to  comply  with  these,laws  could  harm  our  business  reputation  financial
condition and operating results.,
,Authorities around the world have adopted and are considering a number of legislative and regulatory proposals
concerning  data  protection  data  usage  and  portability  and  encryption  of  user  data.  Additionally  the  increasing,
adoption  of AI  technologies  which  rely  on  the  collection  of  large  amounts  of  data  and  use  of  such  data  for  training,
purposes has led data protection authorities around the world to consider and adopt new and evolving interpretations,
of  data  protection  laws  imposing  specific  obligations  with  respect  to  the  processing  of  personal  data  including,
"required  notices  consents  and  opt-outs.  Further 
the","increased 
risk  of 
inadvertent  disclosure  of  confidential"
information  or  personal  data  in  connection  with  the  utilization  of  AI  technologies  may  result  in  stronger  regulatory,
"scrutiny 
leading 
to 
legal  and  regulatory","investigations  and  enforcement  actions 
that  may  negatively  affect  our"
business  even  if  unfounded. Adverse  legal  rulings  legislation  or  regulation  have  resulted  in  and  may  continue  to,
result  in  fines  and  orders  requiring  that  we  change  our  practices  which  have  had  and  could  continue  to  have  an,
adverse  effect  on  how  we  provide  services  harming  our  business  reputation  financial  condition  and  operating,
results. These laws and regulations are evolving and subject to interpretation and compliance obligations could cause,
us  to  incur  substantial  costs  or  harm  the  quality  and  operations  of  our  products  and  services  in  ways  that  harm  our,
business. Examples of these laws include:,
