0,1,2
"•
litigation  or  other  claims 
in  connection  with 
the  acquired  company","including  claims 
from",terminated
employees customers former stockholders or other third parties.,,
,Our failure to address these risks or other problems encountered in connection with our past or future acquisitions,
and  other  strategic  arrangements  could  cause  us  to  fail  to  realize  their  anticipated  benefits  incur  unanticipated,,
liabilities and harm our business generally.,,
,Our acquisitions and other strategic arrangements could also result in dilutive issuances of our equity securities,
the  incurrence  of  debt  contingent  liabilities  or  amortization  expenses  or  impairment  of  goodwill  and/or  purchased,,
long-lived  assets  and  restructuring  charges  any  of  which  could  harm  our  financial  condition  and  operating  results.,,
Also  the  anticipated  benefits  or  value  of  our  acquisitions  and  other  strategic  arrangements  may  not  materialize.  In,,
connection with our divestitures we have agreed and may in the future agree to provide indemnification for certain,,
potential liabilities which could harm our financial condition and operating results.,,
,We  rely  on  highly  skilled  personnel  and  if  we  are  unable  to  retain  or  motivate  key  personnel  hire,
qualified personnel or maintain and continue to adapt our corporate culture we may not be able to grow or,,
operate effectively.,,
,Our performance and future success depends in large part upon the continued service of key technical leads as,
well as members of our senior management team. For instance Sundar Pichai is critical to the overall management of,,
Alphabet  and  its  subsidiaries  and  plays  an  important  role  in  the  development  of  our  technology  maintaining  our,,
culture and setting our strategic direction.,,
,Our  ability  to  compete  effectively  and  our  future  success  depend  on  our  continuing  to  identify  hire  develop,
motivate and retain highly skilled personnel for all areas of our organization. Competition in our industry for qualified,,
"employees 
is 
intense  and  certain  of  our  competitors  have  directly","targeted  and  may  continue 
to",target  our
employees.  In  addition  our  compensation  arrangements  such  as  our  equity  award  programs  may  not  always  be,,
successful in attracting new employees and retaining and motivating our existing employees. Restrictive immigration,,
policy and regulatory changes may also affect our ability to hire mobilize or retain some of our global talent. All of our,,
executive  officers  and  key  employees  are  at-will  employees  and  we  do  not  maintain  any  key-person  life  insurance,,
policies.,,
,In addition we believe that our corporate culture fosters innovation creativity and teamwork. As our organization,
grows  and  evolves  we  may  need,to  adapt  our  corporate  culture  and  work  environments,to  ever-changing
circumstances such as during times of a natural disaster or pandemic and these changes could affect our ability to,,
compete  effectively  or  have  an  adverse  effect  on  our  corporate  culture.  Under  our  hybrid  work  models  we  may,,
experience  increased  costs  and/or  disruption  in  addition  to  potential  effects  on  our  ability  to  operate  effectively  and,,
maintain our corporate culture.,,
"ITEM 1.
UNRESOLVED STAFF COMMENTS",,
Not applicable.,,
ITEM 1C.   CYERSECURITY,,
,We maintain a comprehensive process for identifying assessing and managing material risks from cybersecurity,
threats  as  part  of  our  broader  risk  management  system  and  processes.  We  obtain  input  as  appropriate  for  our,,
cybersecurity risk management program on the security industry and threat trends from multiple external experts and,,
internal threat intelligence teams. Teams of dedicated privacy safety and security professionals oversee cybersecurity,,
risk  management  and  mitigation  incident  prevention  detection  and  remediation.  Leadership  for  these  teams  are,,
professionals  with  deep  cybersecurity  expertise  across  multiple  industries  including  our  Vice  President  of  Privacy,,
"Safety  and  Security  Engineering.  Our  executive 
leadership 
team  along  with","input 
from 
the  above",teams  are
responsible  for  our  overall  enterprise  risk  management  system  and  processes  and  regularly  consider  cybersecurity,,
risks in the context of other material risks to the company.,,
,As part of our cybersecurity risk management system our incident management teams track and log privacy and,
security incidents across Alphabet our vendors and other third-party service providers to remediate and resolve any,,
such incidents. Significant incidents are reviewed regularly by a cross-functional working group to determine whether,,
further  escalation  is  appropriate.  Any  incident  assessed  as  potentially  being  or  potentially  becoming  material  is,,
immediately escalated for further assessment and then reported to designated members of our senior management.,,
We  consult  with  outside  counsel  as  appropriate  including  on  materiality  analysis  and  disclosure  matters  and  our,,
